{
  "id": 2,
  "maxPlayers": 2,
  "imagePath": "/images/gamemap/dangling.jpg",
  "horseSize": 0.8,
  "initialRandomVelocity": 200.0,
  "carrot": [[442, 106], [485, 189], [527, 106]],
  "spawnpoints": [[81, 786], [223, 914]],
  "walls": [
	  [[1000, 22], [4, 20], [2, 3], [999, 1]],
	  [[3, 982], [999, 980], [1000, 1000], [5, 1000]],
	  [[984, 983], [981, 20], [1001, 23], [1001, 981]],
	  [[21, 21], [22, 982], [4, 981], [5, 20]],
	  [[23, 699], [783, 701], [783, 716], [22, 718]],
	  [[347, 411], [346, 435], [983, 442], [984, 409]],
	  [[22, 439], [48, 440], [48, 697], [26, 699]],
	  [[50, 462], [75, 465], [76, 698], [53, 699]],
	  [[80, 503], [112, 502], [115, 695], [88, 692]],
	  [[114, 547], [164, 546], [167, 697], [116, 697]],
	  [[164, 595], [243, 594], [244, 698], [164, 701]],
	  [[243, 652], [317, 655], [320, 700], [245, 697]],
	  [[447, 21], [410, 143], [424, 150], [460, 18]],
	  [[523, 20], [539, 146], [551, 146], [538, 20]],
	  [[418, 982], [419, 907], [439, 908], [441, 982]],
	  [[557, 912], [582, 911], [581, 983], [559, 983]],
	  [[391, 889], [391, 911], [608, 910], [608, 888]]
  ]
}
