{
  "id": 1,
  "maxPlayers": 4,
  "imagePath": "/images/gamemap/minimaze.jpg",
  "horseSize": 1.0,
  "initialRandomVelocity": 200.0,
  "carrot": [[872, 810], [876, 927], [892, 929], [912, 812]],
  "spawnpoints": [[111, 107], [346, 122], [120, 249], [335, 257]],
  "walls": [
    [[1, 2], [999, 3], [1001, 44], [5, 43]],
    [[962, 43], [1000, 44], [1000, 999], [962, 1000]],
    [[2, 44], [40, 42], [41, 999], [4, 998]],
    [[39, 964], [965, 960], [970, 999], [40, 999]],
    [[182, 462], [276, 461], [276, 486], [181, 487]],
    [[605, 248], [625, 272], [760, 162], [745, 135]],
    [[42, 792], [229, 790], [230, 819], [42, 819]],
    [[498, 770], [499, 856], [524, 856], [524, 771]],
    [[433, 271], [433, 631], [459, 631], [458, 272]],
    [[751, 965], [750, 808], [775, 808], [777, 961]],
    [[432, 628], [435, 654], [771, 655], [770, 629]],
    [[962, 444], [964, 468], [756, 465], [757, 440]]
  ]
}
