{
  "id": 3,
  "maxPlayers": 4,
  "imagePath": "/images/gamemap/garden.jpg",
  "horseSize": 0.9,
  "initialRandomVelocity": 60.0,
  "carrot": [[51, 528], [53, 580], [135, 568], [132, 533]],
  "spawnpoints": [[887, 98], [864, 301], [901, 906], [355, 103]],
  "walls": [
    [[1, 2], [2, 1001], [21, 1001], [22, 4]],
    [[982, 2], [983, 1000], [997, 1000], [998, 4]],
    [[23, 5], [983, 7], [984, 23], [22, 23]],
    [[21, 984], [983, 984], [982, 1000], [25, 1001]],
    [[681, 384], [811, 388], [808, 425], [686, 423]],
    [[452, 249], [502, 253], [500, 296], [453, 298]],
    [[583, 81], [576, 123], [621, 128], [624, 87]],
    [[198, 158], [192, 195], [231, 198], [234, 158]],
    [[332, 453], [327, 502], [371, 503], [373, 457]],
    [[70, 442], [73, 504], [130, 502], [129, 444]],
    [[500, 765], [498, 845], [572, 839], [569, 765]],
    [[863, 578], [864, 622], [903, 624], [902, 583]]
  ]
}
